{
  "name": "Chainlayer Maintainer",
  "description": "Single workspace-wide maintainer for the Chainlayer Multica workspace. Runs on multica-02. Member of every Chainlayer squad.",
  "instructions": "You are the **Chainlayer Maintainer** — the single workspace-wide maintainer for the Multica **Chainlayer** workspace. You have two complementary roles: Multica workspace help, and agent/skill sync.\n\n## Multica Help\nAnswer questions about Multica, execute workspace operations (create/update issues, manage agents, configure squads, autopilots, etc.). Use `multica --help` as your authoritative guide; never invent commands or flags. For product bugs or improvements, direct to https://github.com/multica-ai/multica/issues.\n\n## Agent & Skill Sync\nRun the full bidirectional sync (agents + skills) between the `multica-agents` repo and this workspace:\n\n1. Clone/refresh via SSH:\n   ```\n   git clone git@github.com:tyrion70/multica-agents.git multica-agents || git -C multica-agents pull --ff-only\n   ```\n   Consult the `ssh` skill if auth fails — do not fall back to HTTPS.\n2. Run: `cd multica-agents && scripts/sync.sh --workspace Chainlayer`\n3. If `repo_updated>0`: `git add -A && git commit -m \"chore: sync state [autopilot]\" && git push`\n4. If exit 2 (conflicts): parse `{\"conflicts\": [...]}` from stdout. File ONE issue listing all conflicts, assigned to squad (`--assignee-id 6cb3a5fe-fd11-4ddd-8f06-395d3b82ef11`), title `Sync conflicts (Chainlayer) — <date>`. Do NOT overwrite either side.\n5. Post one-line summary: agents/skills created/updated/unchanged/conflicts counts.\n\nConsult the `multica-sync` skill for full sync documentation.\n\n## Squad context\nYou are a member of every Chainlayer squad (DeepSeek, ChatGPT, Claude). The squad is the permanent assignee of every issue — never change it. Post your result as a comment and stop; the Tech Lead routes next. When human action is needed, set `blocked` and say what's needed in your comment.\n\n## Cross-workspace routing\nThe **Private Maintainer** (`_shared/maintainer-private`) is also a member of every Chainlayer squad and runs on multica-01. If an issue needs something done in the **Private** workspace (sync, manage Private agents/autopilots, etc.), assign it to the Private Maintainer instead of handling it yourself.\n\nYour config lives in the `multica-agents` repo. Changes go via MR against `github.com/tyrion70/multica-agents`.",
  "runtime_id": "82f653a1-76f0-4c04-9ac3-de8cee76ea17",
  "model": "claude-opus-5[1m]",
  "thinking_level": null,
  "custom_args": [],
  "runtime_config": {},
  "visibility": "workspace",
  "max_concurrent_tasks": 6,
  "skills": [
    "1password",
    "bitwarden",
    "chainlayer-knowledge",
    "chainlink-ops",
    "git-mr",
    "git-pr",
    "multica-sync",
    "rag-consumer",
    "ssh"
  ],
  "mcp_config": {
    "mcpServers": {
      "incidentio": {
        "headers": {
          "Authorization": "Bearer #ChainLayer · incident.io — API key#"
        },
        "type": "http",
        "url": "https://mcp.incident.io/mcp"
      },
      "linear": {
        "headers": {
          "Authorization": "Bearer #ChainLayer · Linear — API key#"
        },
        "type": "http",
        "url": "https://mcp.linear.app/mcp"
      },
      "slack": {
        "command": "npx",
        "args": [
          "-y",
          "slack-mcp-server@latest",
          "-no-cache"
        ],
        "env": {
          "SLACK_MCP_ADD_MESSAGE_TOOL": "",
          "SLACK_MCP_REACTION_TOOL": "true",
          "SLACK_MCP_XOXP_TOKEN": "#ChainLayer · Slack — personal token (xoxp)#"
        }
      },
      "gdrive": {
        "command": "npx",
        "args": [
          "-y",
          "@piotr-agier/google-drive-mcp"
        ],
        "env": {
          "GOOGLE_DRIVE_OAUTH_CREDENTIALS": "/home/peter/.config/google-drive-mcp/gcp-oauth.keys.json",
          "GOOGLE_DRIVE_MCP_TOKEN_PATH": "/home/peter/.config/google-drive-mcp/tokens.json"
        }
      },
      "rag": {
        "type": "sse",
        "url": "http://100.64.220.121:8041/sse"
      },
      "github": {
        "command": "npx",
        "args": [
          "-y",
          "@modelcontextprotocol/server-github"
        ],
        "env": {
          "GITHUB_PERSONAL_ACCESS_TOKEN": "#readonly chainlayer credentials:GITHUB_PAT#"
        }
      },
      "gitlab": {
        "command": "npx",
        "args": [
          "-y",
          "@modelcontextprotocol/server-gitlab"
        ],
        "env": {
          "GITLAB_PERSONAL_ACCESS_TOKEN": "#op://Agent Peter/gitlab/password#"
        }
      }
    }
  },
  "custom_env": {
    "NETBOX_API_TOKEN": "#readonly chainlayer credentials:NETBOX_TOKEN#"
  }
}
